Название товара,Username,"Локация(страна, город)",Репутация,Заголовок отзывыа,Достоинства,Недостатки,Текст отзыва,Сколько человек рекомендует отзыв,Количество комментариев
"Антидепрессант Торрент Фармасьютикалс ""Серената""",Elena Lenochka,"Россия, Тамбов",+15077,"Постоянно, как под мухой, побочки не заставляют себя ждать. Работает, но какой ценой...","помогает от депрессии, вернул аппетит","резкое похудение, мутная голова, сонливость","При моей первой депрессии, после того, как мне не подошла ",Отзыв рекомендуют:19,15
"Антидепрессант Торрент Фармасьютикалс ""Серената""",MariaLys,"Россия, Воронеж",+1701,Две стороны одной медали,"Снимает тревогу, возвращает радость восприятия",Появились побочные эффекты,"Препарат Серената мне прописал психотерапевт когда я обратилась с жалобой на затяжную депрессию и хроническую усталость. Серенату мне продали в аптеке строго по рецепту за 600 руб. Врач назначил принимать 7 дней по 0,5 таблетки, потом по 1 таблетке после завтрака.",Отзыв рекомендуют:4,1
"Антидепрессант Торрент Фармасьютикалс ""Серената""",kodonio,"Россия, Волгоград",+230,"Отличный антидепрессант нового поколения! Будьте внимательны и осторожны с дозировкой, врач не всегда прав!)","Работает так, как и должен! И побочки меня уже давно не пугают, немного терпения - и проходят.","редко бывает в аптеках, могут потребовать рецепт","Как человек, измученных хроническим неврозом желудка, вынуждена прибегать к препаратам из группы СИЗОС довольно регулярно. Бывают периоды эмоционального благополучия, когда в таких препаратах нет никакой нужны, а бывают и сложные жизненные этапы, когда очень важно сохранить хорошее самочувствие и работоспособность.",Отзыв рекомендуют:6,0
"Антидепрессант Торрент Фармасьютикалс ""Серената""",Aleksandrovichhh,"Россия, Москва",+55,Не очень.,Их нет,"Ужас, нет эффекта","Здравствуйте, читатели моего отзыва. Как я описывал в других своих отзывах о антидепрессантах, у меня есть депрессивное расстройство с тревогой. Первый раз придя к психотерапевту на прием, мне были выписаны эти таблетки. ",Отзыв рекомендуют:4,0
"Антидепрессант Торрент Фармасьютикалс ""Серената""",DmitrijBSCS,"Россия, Самара",+3,Хорошее средство,Помогает от депрессии Приемлимая цена,Не обнаружил,"Обратился я к психиатру с тревогой и депрессией. Он назначил мне препарат ""Золофт"" в дозировке 50 мг по 2 таблетки в день. Придя в аптеку мне подсказали, что есть аналог ""Золофта"" - ""Серената"", действует также, а стоит на порядок ниже. Начал я принимать ""Серенату"" по 2 таблетки в день. Побочных эффектов я не заметил. Уже через 3 недели я почувствовал заметное улучшение настроения, у меня появился вкус к жизни, тревога уменьшилась. Принимал я ""Серенату"" на протяжении 6 месяцев (психиатр сказал, что все антидепрессанты нужно принимать не менее полугода). Благодаря ""Серенате"" моя жизнь кардинально изменилась в лучшую сторону. При депрессии рекомендую!",Отзыв рекомендуют:2,0
"Антидепрессант Торрент Фармасьютикалс ""Серената""",Катя Сова,"Россия, Курск",+4,Невроз или головная боль?,Улучшает настроение,"Первые дни приёма адовые, пока проблему не решил","О том, что антидепрессанты выписывают не только при депрессиях и прочих нервных расстройствах, я узнала, когда столкнулась с головной болью и непрекращающейся тошнотой. Никто из врачей не знал, что со мной делать. В итоге, все списали на невроз. На тот момент у меня уже реально начинался невроз на фоне плохого самочувствия. Врач назначил мне антидепрессант, объясняя мое состояние головной болью напряжения на фоне стрессов. Правда, я про стрессы и слова не сказала) Но я все-таки рискнула начать приём лекарства, потому что мое состояние было очень изматывающим. Так я и начала приём Серенаты. Принимать начала в дозе 50 мг по половинке на ночь, т. е. 25 мг. Естественно, лекарство покупается строго по рецепту, который после покупки забирает фармацевт. Упаковка маленькая, таблетки без вкуса и запаха.",Отзыв рекомендуют:2,0
"Антидепрессант Торрент Фармасьютикалс ""Серената""",Chepus,"Россия, Санкт-Петербург",+1062,Дженерик Золофта,не нашел,для меня не приемлем из-за массы побочных действий,"
",Отзыв рекомендуют:12,2
"Антидепрессант Торрент Фармасьютикалс ""Серената""",Irinkoer,"Россия, Ярославль",+287,До конца не помог,Был эффект,До конца не помог,Всем доброго времени суток!,Отзыв рекомендуют:5,0
